{
  "source_id": "S-016",
  "snapshot_id": "SNAP-20260607T002537Z",
  "summarized_at": "2026-06-07T00:25:37+00:00",
  "document_purpose": "Initial machine summary for official_documentation. Agent review required.",
  "summary": ":root { --tab-size-preference: 4; } pre, code { tab-size: var(--tab-size-preference); } {\"locale\":\"en\",\"featureFlags\":[\"actions_custom_images_storage_billing_ui_visibility\",\"actions_image_version_event\",\"actions_workflow_language_service_allow_concurrency_queue\",\"agent_conflict_resolution\",\"alternate_user_config_repo\",\"arianotify_comprehensive_migration\",\"artifact_ui_v2\",\"billing_discount_threshold_notification\",\"billing_user_level_budgets\",\"billing_user_level_budgets_manage\",\"code_scanning_dfa_degraded_experience_notice\",\"codespaces_prebuild_region_target_update\",\"coding_agent_model_selection\",\"coding_agent_model_selection_all_skus\",\"coding_agent_session_ai_credits\",\"comment_viewer_copy_raw_markdown\",\"contentful_form_phone_v2\",\"contentful_primer_code_blocks\",\"copilot_agent_snippy\",\"copilot_api_agentic_issue_marshal_yaml\",\"copilot_ask_mode_dropdown\",\"copilot_automation_suggest_tools_enabled\",\"copilot_automations_suggested_automations\",\"copilot_chat_attach_multiple_images\",\"copilot_chat_category_rate_limit_messages\",\"copilot_chat_clear_model_selection_for_default_change\",\"copilot_chat_contextual_suggestions_updated\",\"copilot_chat_docked_panel\",\"copilot_chat_enable_tool_call_logs\",\"c",
  "categories": [],
  "key_points": [],
  "keywords": [],
  "entities": [],
  "limitations": [
    "This is an initial machine-generated extraction and must be reviewed by an agent."
  ],
  "potential_questions": []
}
