{
  "source_id": "S-058",
  "snapshot_id": "SNAP-20260531T133941Z",
  "summarized_at": "2026-05-31T14:01:29+00:00",
  "document_purpose": "深度來源摘要：Thoughtworks Technology Radar。",
  "summary": "Thoughtworks Technology Radar。將 SDD 列為 assess，區分 spec-first 與 spec-anchored，提醒 consistency、security、tooling 與 brownfield 限制。關鍵技術包括：Technology Radar, adoption trade-offs, brownfield, security。",
  "categories": [
    "article"
  ],
  "key_points": [
    {
      "text": "將 SDD 列為 assess，區分 spec-first 與 spec-anchored，提醒 consistency、security、tooling 與 brownfield 限制",
      "locator": "README or official documentation overview",
      "notes": "Agent-reviewed catalog summary; return to raw snapshot for publication claims."
    }
  ],
  "keywords": [
    "Thoughtworks Technology Radar",
    "article"
  ],
  "entities": [],
  "limitations": [
    "Repository 或官方文件可用於理解公開設計；production readiness 仍需安裝測試、維護狀態與 benchmark 驗證。"
  ],
  "potential_questions": [],
  "role_in_ecosystem": "Thoughtworks Technology Radar",
  "architecture_fit": "位於方法論與採用經驗層，用來補足工具文件未涵蓋的實作觀點、 trade-off 與導入風險。",
  "workflow_outline": [
    "辨識文章主張與適用範圍",
    "拆分直接事實、作者觀點與案例",
    "對照官方工具文件",
    "保留可驗證的 adoption insight",
    "將未驗證主張標記為限制"
  ],
  "key_features": [
    "將 SDD 列為 assess，區分 spec-first 與 spec-anchored，提醒 consistency、security、tooling 與 brownfield 限制",
    "架構層級：article",
    "輸出應保存為可追溯 artifact，重要結論需回讀 raw snapshot。"
  ],
  "key_technologies": [
    "Technology Radar",
    "adoption trade-offs",
    "brownfield",
    "security"
  ],
  "best_for": [
    "article",
    "快速判斷此工具在整體 SDD 架構中的責任",
    "作為試點工具選型與後續深挖入口"
  ],
  "research_value": "此來源用於理解 Thoughtworks Technology Radar 在整體架構中的角色。重要結論仍需回讀本地 raw snapshot 與原始 URL。",
  "verification_questions": [
    "作者是否為官方或具編輯審查來源？",
    "文章主張是否有案例或數據支持？",
    "哪些結論只能作為採用假設？"
  ]
}
