{
  "source_id": "S-034",
  "snapshot_id": "SNAP-20260607T004157Z",
  "summarized_at": "2026-06-07T00:41:57+00:00",
  "document_purpose": "Initial machine summary for official_documentation. Agent review required.",
  "summary": "Building Effective AI Agents a.cta_button{-moz-box-sizing:content-box !important;-webkit-box-sizing:content-box !important;box-sizing:content-box !important;vertical-align:middle}.hs-breadcrumb-menu{list-style-type:none;margin:0px 0px 0px 0px;padding:0px 0px 0px 0px}.hs-breadcrumb-menu-item{float:left;padding:10px 0px 10px 10px}.hs-breadcrumb-menu-divider:before{content:'›';padding-left:10px}.hs-featured-image-link{border:0}.hs-featured-image{float:right;margin:0 0 20px 20px;max-width:50%}@media (max-width: 568px){.hs-featured-image{float:none;margin:0;width:100%;max-width:100%}}.hs-screen-reader-text{clip:rect(1px, 1px, 1px, 1px);height:1px;overflow:hidden;position:absolute !important;width:1px} #hs_cos_wrapper_module_173932036864017 .simple-header { background-color:#FAFAF8; } #hs_cos_wrapper_module_173932036864017 .simple-header .container { max-width:1312px; margin:auto; display:flex; justify-content:space-between; padding:14px 0; align-items:center; } #hs_cos_wrapper_module_173932036864017 .simple-header .logo img { display:block; } #hs_cos_wrapper_module_173932036864017 .simple-header .cta-btn { line-height:100%; padding:14px 20px; border-radius:14px; line-height:125%; letter",
  "categories": [],
  "key_points": [],
  "keywords": [],
  "entities": [],
  "limitations": [
    "This is an initial machine-generated extraction and must be reviewed by an agent."
  ],
  "potential_questions": []
}
