{
  "source_id": "S-022",
  "snapshot_id": "SNAP-20260531T113912Z",
  "summarized_at": "2026-05-31T14:01:29+00:00",
  "document_purpose": "深度來源摘要：Rover。",
  "summary": "Rover。背景 coding agents 與隔離 workspace。關鍵技術包括：parallel agents, workspace isolation, background jobs。",
  "categories": [
    "adjacent_tooling",
    "execution_runtime",
    "isolation",
    "orchestration"
  ],
  "key_points": [
    {
      "text": "Rover 管理背景 coding-agent 工作。",
      "locator": "README overview"
    },
    {
      "text": "隔離 workspace 支援平行工作並降低互相干擾。",
      "locator": "README workflow"
    }
  ],
  "keywords": [
    "Rover",
    "background agents",
    "execution_runtime",
    "parallel",
    "workspace isolation"
  ],
  "entities": [
    "Endor",
    "Rover"
  ],
  "limitations": [
    "Repository 或官方文件可用於理解公開設計；production readiness 仍需安裝測試、維護狀態與 benchmark 驗證。",
    "Rover 解決執行隔離，不負責規格品質。"
  ],
  "potential_questions": [
    "workspace 合併前需要哪些自動 review？"
  ],
  "role_in_ecosystem": "Rover",
  "key_features": [
    "背景 coding agents 與隔離 workspace",
    "架構層級：execution_runtime",
    "輸出應保存為可追溯 artifact，重要結論需回讀 raw snapshot。"
  ],
  "key_technologies": [
    "parallel agents",
    "workspace isolation",
    "background jobs"
  ],
  "best_for": [
    "execution_runtime",
    "快速判斷此工具在整體 SDD 架構中的責任",
    "作為試點工具選型與後續深挖入口"
  ],
  "research_value": "此來源用於理解 Rover 在整體架構中的角色。重要結論仍需回讀本地 raw snapshot 與原始 URL。",
  "architecture_fit": "位於 execution runtime 層，管理長時間 agent session、workspace、scheduler、retry 與 observability。",
  "workflow_outline": [
    "取得 issue 或 task",
    "建立隔離 workspace",
    "啟動 agent runtime",
    "監控 log 與狀態",
    "完成、retry 或 escalation"
  ],
  "verification_questions": [
    "workspace 是否真正隔離？",
    "retry 是否具冪等性？",
    "log、成本、權限與錯誤是否可觀測？"
  ]
}
