{
  "source_id": "S-045",
  "snapshot_id": "SNAP-20260531T121226Z",
  "summarized_at": "2026-05-31T14:01:29+00:00",
  "document_purpose": "深度來源摘要：Codexia。",
  "summary": "Codexia。Codex 與 Claude agent workstation：scheduler、worktree、remote control、permission。關鍵技術包括：Tauri, Rust, JSON-RPC, WebSocket, scheduler, process isolation。",
  "categories": [
    "execution_runtime"
  ],
  "key_points": [
    {
      "text": "Codex 與 Claude agent workstation：scheduler、worktree、remote control、permission",
      "locator": "README or official documentation overview",
      "notes": "Agent-reviewed catalog summary; return to raw snapshot for publication claims."
    }
  ],
  "keywords": [
    "Codexia",
    "execution_runtime"
  ],
  "entities": [],
  "limitations": [
    "Repository 或官方文件可用於理解公開設計；production readiness 仍需安裝測試、維護狀態與 benchmark 驗證。"
  ],
  "potential_questions": [],
  "role_in_ecosystem": "Codexia",
  "key_features": [
    "Codex 與 Claude agent workstation：scheduler、worktree、remote control、permission",
    "架構層級：execution_runtime",
    "輸出應保存為可追溯 artifact，重要結論需回讀 raw snapshot。"
  ],
  "key_technologies": [
    "Tauri",
    "Rust",
    "JSON-RPC",
    "WebSocket",
    "scheduler",
    "process isolation"
  ],
  "best_for": [
    "execution_runtime",
    "快速判斷此工具在整體 SDD 架構中的責任",
    "作為試點工具選型與後續深挖入口"
  ],
  "research_value": "此來源用於理解 Codexia 在整體架構中的角色。重要結論仍需回讀本地 raw snapshot 與原始 URL。",
  "architecture_fit": "位於 execution runtime 層，管理長時間 agent session、workspace、scheduler、retry 與 observability。",
  "workflow_outline": [
    "取得 issue 或 task",
    "建立隔離 workspace",
    "啟動 agent runtime",
    "監控 log 與狀態",
    "完成、retry 或 escalation"
  ],
  "verification_questions": [
    "workspace 是否真正隔離？",
    "retry 是否具冪等性？",
    "log、成本、權限與錯誤是否可觀測？"
  ]
}
