{
  "source_id": "S-002",
  "snapshot_id": "SNAP-20260607T002245Z",
  "summarized_at": "2026-06-07T00:22:45+00:00",
  "document_purpose": "Initial machine summary for official_documentation. Agent review required.",
  "summary": "Announcing the Agent2Agent Protocol (A2A) - Google Developers Blog { \"@context\": \"https://schema.org\", \"@type\": \"BreadcrumbList\", \"itemListElement\": [{ \"@type\": \"ListItem\", \"position\": 1, \"name\": \"Google for Developers Blog\", \"item\": \"https://developers.googleblog.com/\" },{ \"@type\": \"ListItem\", \"position\": 2, \"name\": \"Announcing the Agent2Agent Protocol (A2A)\", \"item\": \"https://developers.googleblog.com/en/a2a-a-new-era-of-agent-interoperability/\" }] } { \"@context\": \"https://schema.org\", \"@type\": \"Article\", \"headline\": \"Announcing the Agent2Agent Protocol (A2A)\", \"description\": \"Agent2Agent (A2A) protocol is an open standard designed to enable AI agents from different vendors and frameworks to collaborate and exchange information across enterprise platforms aiming to foster a future of seamless AI agent interoperability and enhanced automation.\", \"image\": \"https://storage.googleapis.com/gweb-developer-goog-blog-assets/images/Agent2Agent-Interoperability.2e16d0ba.fill-800x400.png\", \"datePublished\": \"2025-04-09\", \"author\": [ { \"@type\": \"Person\", \"name\": \"Rao Surapaneni\", \"url\": \"/en/search/?author=Rao+Surapaneni\" }, { \"@type\": \"Person\", \"name\": \"Miku Jha\", \"url\": \"/en/search/?author=",
  "categories": [],
  "key_points": [],
  "keywords": [],
  "entities": [],
  "limitations": [
    "This is an initial machine-generated extraction and must be reviewed by an agent."
  ],
  "potential_questions": []
}
