{
  "source_id": "S-041",
  "snapshot_id": "SNAP-20260607T004201Z",
  "summarized_at": "2026-06-07T00:42:01+00:00",
  "document_purpose": "Initial machine summary for official_documentation. Agent review required.",
  "summary": "--> window.dataLayer = window.dataLayer || []; function gtag(){dataLayer.push(arguments);} gtag('js', new Date()); gtag('config', 'UA-4531126-1'); --> if(Cookies.get('cookies-ok') == 'true' && window.ga === undefined) { window.ga=window.ga||function(){(ga.q=ga.q||[]).push(arguments)};ga.l=+new Date; ga('create', 'UA-4531126-1', 'auto'); ga('send', 'pageview'); } else if (Cookies.get('cookies-ok') == 'true') { ga('send', 'pageview'); } function handleOutboundLinkClicks(event) { var href = ''; if(event.target.href == undefined) href = event.target.parentElement.href; else href = event.target.href if(Cookies.get('cookies-ok') == 'true'){ ga('send', 'event', { eventCategory: 'Outbound Link', eventAction: 'click', eventLabel: href, transport: 'beacon' }); } } OWASP Agentic Skills Top 10 | OWASP Foundation $(function(){ var baseurl = \"https://github.com/OWASP/www-project-agentic-skills-top-10/blob/master/\"; var path = \"index.md\"; $('.repo').html(' Edit on GitHub '); }); For full functionality of this site it is necessary to enable JavaScript. Here are the instructions how to enable JavaScript in your web browser . #banner img { max-width: 30em; } @media (max-width: 1131px) { #banner img ",
  "categories": [],
  "key_points": [],
  "keywords": [],
  "entities": [],
  "limitations": [
    "This is an initial machine-generated extraction and must be reviewed by an agent."
  ],
  "potential_questions": []
}
