{
  "source_id": "S-086",
  "snapshot_id": "SNAP-20260531T135907Z",
  "summarized_at": "2026-05-31T14:01:30+00:00",
  "document_purpose": "深度來源摘要：OWASP AISVS。",
  "summary": "OWASP AISVS。提供 AI-enabled system 可測試、可實作的安全 requirements catalogue。關鍵技術包括：AISVS, AI security requirements, CI/CD, assessment。",
  "categories": [
    "assurance"
  ],
  "key_points": [
    {
      "text": "提供 AI-enabled system 可測試、可實作的安全 requirements catalogue",
      "locator": "README or official documentation overview",
      "notes": "Agent-reviewed catalog summary; return to raw snapshot for publication claims."
    }
  ],
  "keywords": [
    "OWASP AISVS",
    "assurance"
  ],
  "entities": [],
  "limitations": [
    "Repository 或官方文件可用於理解公開設計；production readiness 仍需安裝測試、維護狀態與 benchmark 驗證。"
  ],
  "potential_questions": [],
  "role_in_ecosystem": "OWASP AISVS",
  "architecture_fit": "位於 assurance framework 層，提供安全開發實務、驗證控制、風險等級與持續改善基準。",
  "workflow_outline": [
    "選擇適用控制",
    "將控制映射到需求與流程",
    "在 pipeline 蒐集 evidence",
    "執行自動與人工驗證",
    "持續改善並回應殘餘風險"
  ],
  "key_features": [
    "提供 AI-enabled system 可測試、可實作的安全 requirements catalogue",
    "架構層級：assurance",
    "輸出應保存為可追溯 artifact，重要結論需回讀 raw snapshot。"
  ],
  "key_technologies": [
    "AISVS",
    "AI security requirements",
    "CI/CD",
    "assessment"
  ],
  "best_for": [
    "assurance",
    "快速判斷此工具在整體 SDD 架構中的責任",
    "作為試點工具選型與後續深挖入口"
  ],
  "research_value": "此來源用於理解 OWASP AISVS 在整體架構中的角色。重要結論仍需回讀本地 raw snapshot 與原始 URL。",
  "verification_questions": [
    "控制是否 outcome-based 且可提供 evidence？",
    "哪些控制可自動驗證？",
    "高 assurance 情境是否需要獨立覆核？"
  ]
}
