{
  "source_id": "S-032",
  "snapshot_id": "SNAP-20260607T003957Z",
  "summarized_at": "2026-06-07T00:39:57+00:00",
  "document_purpose": "Initial machine summary for official_documentation. Agent review required.",
  "summary": "Agent Connect Protocol",
  "categories": [],
  "key_points": [],
  "keywords": [],
  "entities": [],
  "limitations": [
    "This is an initial machine-generated extraction and must be reviewed by an agent."
  ],
  "potential_questions": []
}
