{
  "source_id": "S-013",
  "snapshot_id": "SNAP-20260531T113859Z",
  "summarized_at": "2026-05-31T14:01:29+00:00",
  "document_purpose": "深度來源摘要：Specs CLI。",
  "summary": "Specs CLI。DSPI workflow，重視 specification-planning-implementation traceability。關鍵技術包括：traceability, CLI, implementation mapping。",
  "categories": [
    "direct_sdd",
    "tooling",
    "traceability",
    "workflow"
  ],
  "key_points": [
    {
      "text": "Specs CLI 以 DSPI workflow 管理規格、規劃與實作。",
      "locator": "README overview"
    },
    {
      "text": "traceability 是此類工具的核心價值之一。",
      "locator": "README features"
    }
  ],
  "keywords": [
    "DSPI",
    "Specs CLI",
    "direct_sdd",
    "implementation",
    "traceability"
  ],
  "entities": [
    "Specs CLI"
  ],
  "limitations": [
    "Repository 或官方文件可用於理解公開設計；production readiness 仍需安裝測試、維護狀態與 benchmark 驗證。",
    "本次未驗證 traceability schema 的完整性。"
  ],
  "potential_questions": [
    "是否能將 requirement 映射到 test 與 commit？"
  ],
  "role_in_ecosystem": "Specs CLI",
  "key_features": [
    "DSPI workflow，重視 specification-planning-implementation traceability",
    "架構層級：direct_sdd",
    "輸出應保存為可追溯 artifact，重要結論需回讀 raw snapshot。"
  ],
  "key_technologies": [
    "traceability",
    "CLI",
    "implementation mapping"
  ],
  "best_for": [
    "direct_sdd",
    "快速判斷此工具在整體 SDD 架構中的責任",
    "作為試點工具選型與後續深挖入口"
  ],
  "research_value": "此來源用於理解 Specs CLI 在整體架構中的角色。重要結論仍需回讀本地 raw snapshot 與原始 URL。",
  "architecture_fit": "位於 specification artifact 與 traceability 層，負責把需求轉成可演進、可檢查、可交給 agent 執行的狀態。",
  "workflow_outline": [
    "建立或匯入需求",
    "產生 specification 與 design",
    "拆解 tasks",
    "執行或交付 coding agent",
    "回寫驗證結果與 refinement"
  ],
  "verification_questions": [
    "artifact 是否可版本控制並支援差異比較？",
    "requirement、task、test 與 commit 是否能互相回指？",
    "是否支援 approval、resume 與 brownfield 更新？"
  ]
}
