{
  "source_id": "S-018",
  "snapshot_id": "SNAP-20260531T113906Z",
  "summarized_at": "2026-05-31T14:01:29+00:00",
  "document_purpose": "深度來源摘要：Kata。",
  "summary": "Kata。以 Tree-sitter 與 SQLite 建立 repository-aware context。關鍵技術包括：Tree-sitter, SQLite, code indexing, orchestration。",
  "categories": [
    "adjacent_tooling",
    "brownfield",
    "context_engineering",
    "orchestration"
  ],
  "key_points": [
    {
      "text": "Kata 使用 Tree-sitter 解析 code 並以 SQLite 保存 context。",
      "locator": "README architecture"
    },
    {
      "text": "repository-aware context 用於支援 agent 執行。",
      "locator": "README overview"
    }
  ],
  "keywords": [
    "Kata",
    "SQLite",
    "Tree-sitter",
    "brownfield",
    "code context",
    "context_engineering"
  ],
  "entities": [
    "Kata"
  ],
  "limitations": [
    "Repository 或官方文件可用於理解公開設計；production readiness 仍需安裝測試、維護狀態與 benchmark 驗證。",
    "本次未測試索引準確率與大型 repository 效能。"
  ],
  "potential_questions": [
    "context index 如何與 spec traceability 合併？"
  ],
  "role_in_ecosystem": "Kata",
  "key_features": [
    "以 Tree-sitter 與 SQLite 建立 repository-aware context",
    "架構層級：context_engineering",
    "輸出應保存為可追溯 artifact，重要結論需回讀 raw snapshot。"
  ],
  "key_technologies": [
    "Tree-sitter",
    "SQLite",
    "code indexing",
    "orchestration"
  ],
  "best_for": [
    "context_engineering",
    "快速判斷此工具在整體 SDD 架構中的責任",
    "作為試點工具選型與後續深挖入口"
  ],
  "research_value": "此來源用於理解 Kata 在整體架構中的角色。重要結論仍需回讀本地 raw snapshot 與原始 URL。",
  "architecture_fit": "位於 repository context 層，降低 agent 對大型或既有 codebase 理解不足的風險。",
  "workflow_outline": [
    "掃描 repository",
    "建立結構或語意索引",
    "選取與 task 相關 context",
    "提供 agent 執行",
    "依變更更新索引"
  ],
  "verification_questions": [
    "大型 repository 的索引成本是多少？",
    "context 選取錯誤如何偵測？",
    "索引是否能與 requirement traceability 結合？"
  ]
}
