{
  "source_id": "S-079",
  "snapshot_id": "SNAP-20260531T135855Z",
  "summarized_at": "2026-05-31T14:01:29+00:00",
  "document_purpose": "深度來源摘要：NASA SWE-059。",
  "summary": "NASA SWE-059。要求 software requirements 與 software design 雙向 traceability，並以 matrix 維護 requirement、design、code 與 verification 關係。關鍵技術包括：requirement IDs, bidirectional traceability matrix, orphan detection, impact analysis。",
  "categories": [
    "traceability"
  ],
  "key_points": [
    {
      "text": "要求 software requirements 與 software design 雙向 traceability，並以 matrix 維護 requirement、design、code 與 verification 關係",
      "locator": "README or official documentation overview",
      "notes": "Agent-reviewed catalog summary; return to raw snapshot for publication claims."
    }
  ],
  "keywords": [
    "NASA SWE-059",
    "traceability"
  ],
  "entities": [],
  "limitations": [
    "Repository 或官方文件可用於理解公開設計；production readiness 仍需安裝測試、維護狀態與 benchmark 驗證。"
  ],
  "potential_questions": [],
  "role_in_ecosystem": "NASA SWE-059",
  "architecture_fit": "位於 requirements assurance 層，要求需求、設計、code、test、hazard 與 non-conformance 可雙向追溯。",
  "workflow_outline": [
    "為 requirement 配置唯一 ID",
    "將 requirement 映射到 design",
    "將 design 映射到 code",
    "將 requirement 映射到 verification",
    "檢查 orphan、extra 與變更影響"
  ],
  "key_features": [
    "要求 software requirements 與 software design 雙向 traceability，並以 matrix 維護 requirement、design、code 與 verification 關係",
    "架構層級：traceability",
    "輸出應保存為可追溯 artifact，重要結論需回讀 raw snapshot。"
  ],
  "key_technologies": [
    "requirement IDs",
    "bidirectional traceability matrix",
    "orphan detection",
    "impact analysis"
  ],
  "best_for": [
    "traceability",
    "快速判斷此工具在整體 SDD 架構中的責任",
    "作為試點工具選型與後續深挖入口"
  ],
  "research_value": "此來源用於理解 NASA SWE-059 在整體架構中的角色。重要結論仍需回讀本地 raw snapshot 與原始 URL。",
  "verification_questions": [
    "是否能雙向追溯？",
    "是否偵測 orphan design、extra code 與未驗證 requirement？",
    "baseline 變更是否經審批並更新 matrix？"
  ]
}
