{
  "source_id": "S-026",
  "snapshot_id": "SNAP-20260607T003945Z",
  "summarized_at": "2026-06-07T00:39:46+00:00",
  "document_purpose": "Initial machine summary for official_documentation. Agent review required.",
  "summary": "Multi-agent - Docs by LangChain !function(){var b=\"\"; function a(p){if(p==null)return\"/\";p=\"\"+p;if(\"\"===p)return\"/\";return\"/\"===p.charAt(0)?p:\"/\"+p} function u(p){if(p==null)return p;p=\"\"+p;if(!p||p.charAt(p.length-1)===\"/\")return p.slice(0,-1);return p} function i(p){if(p==null)return p;p=\"\"+p;if(6 (function(a,b){try{let c=document.getElementById(\"banner\")?.innerText;if(c){for(let d=0;d ((a,b,c,d,e,f,g,h)=>{let i=document.documentElement,j=[\"light\",\"dark\"];function k(b){var c;(Array.isArray(a)?a:[a]).forEach(a=>{let c=\"class\"===a,d=c&&f?e.map(a=>f[a]||a):e;c?(i.classList.remove(...d),i.classList.add(f&&f[b]?f[b]:b)):i.setAttribute(a,b)}),c=b,h&&j.includes(c)&&(i.style.colorScheme=c)}if(d)k(d);else try{let a=localStorage.getItem(b)||c,d=g&&\"system\"===a?window.matchMedia(\"(prefers-color-scheme: dark)\").matches?\"dark\":\"light\":a;k(d)}catch(a){}})(\"class\",\"isDarkMode\",\"system\",null,[\"dark\",\"light\",\"true\",\"false\",\"system\"],{\"true\":\"dark\",\"false\":\"light\",\"dark\":\"dark\",\"light\":\"light\"},true,false) Documentation Index Fetch the complete documentation index at: /llms.txt Use this file to discover all available pages before exploring further. :root{--banner-height:0px!important} (self.__next",
  "categories": [],
  "key_points": [],
  "keywords": [],
  "entities": [],
  "limitations": [
    "This is an initial machine-generated extraction and must be reviewed by an agent."
  ],
  "potential_questions": []
}
